03:26:43.197766 IP 192.168.1.14.5353 > 224.0.0.251.5353: 0 PTR (QU)? _spotify-social-listening._tcp.local. (54)
03:26:43.197767 IP6 fe80::4fb:be99:9079:88f9.5353 > ff02::fb.5353: 0 PTR (QU)? _spotify-social-listening._tcp.local. (54)
03:26:43.198013 IP 192.168.1.14.5353 > 224.0.0.251.5353: 0 PTR (QM)? _spotify-connect._tcp.local. (45)
03:26:43.200522 IP6 fe80::4fb:be99:9079:88f9.5353 > ff02::fb.5353: 0 PTR (QM)? _spotify-connect._tcp.local. (45)
03:26:43.404169 ARP, Request who-has 192.168.1.11 (e6:bd:8e:53:30:d6) tell 192.168.1.14, length 28
03:26:43.404170 IP 192.168.1.14.52174 > 192.168.1.11.7000: Flags [SEW], seq 3974124250, win 65535, options [mss 1460,nop,wscale 6,nop,nop,TS val 1478889321 ecr 0,sackOK,eol], length 0
03:26:43.404212 ARP, Reply 192.168.1.11 is-at e6:bd:8e:53:30:d6, length 28
03:26:43.404404 IP 192.168.1.11.7000 > 192.168.1.14.52174: Flags [S.E], seq 359606941, ack 3974124251, win 65535, options [mss 1460,nop,wscale 6,nop,nop,TS val 658353719 ecr 1478889321,sackOK,eol], length 0
03:26:43.408962 IP 192.168.1.14.52174 > 192.168.1.11.7000: Flags [.], ack 1, win 2059, options [nop,nop,TS val 1478889416 ecr 658353719], length 0
03:26:43.409020 IP 192.168.1.11.7000 > 192.168.1.14.52174: Flags [.], ack 1, win 2059, options [nop,nop,TS val 658353724 ecr 1478889416], length 0
03:26:43.409674 IP 192.168.1.14.52174 > 192.168.1.11.7000: Flags [P.], seq 1:58, ack 1, win 2059, options [nop,nop,TS val 1478889417 ecr 658353719], length 57
03:26:43.409702 IP 192.168.1.11.7000 > 192.168.1.14.52174: Flags [.], ack 58, win 2059, options [nop,nop,TS val 658353724 ecr 1478889417], length 0
03:26:43.417007 IP 192.168.1.11.7000 > 192.168.1.14.52174: Flags [.], seq 1:1449, ack 58, win 2059, options [nop,nop,TS val 658353732 ecr 1478889417], length 1448
03:26:43.417039 IP 192.168.1.11.7000 > 192.168.1.14.52174: Flags [P.], seq 1449:1976, ack 58, win 2059, options [nop,nop,TS val 658353732 ecr 1478889417], length 527
03:26:43.423806 IP 192.168.1.14.52174 > 192.168.1.11.7000: Flags [.], ack 1976, win 2029, options [nop,nop,TS val 1478889431 ecr 658353732], length 0
03:26:43.425976 IP 192.168.1.14.52174 > 192.168.1.11.7000: Flags [F.], seq 58, ack 1976, win 2048, options [nop,nop,TS val 1478889432 ecr 658353732], length 0
03:26:43.426006 IP 192.168.1.11.7000 > 192.168.1.14.52174: Flags [.], ack 59, win 2059, options [nop,nop,TS val 658353741 ecr 1478889432], length 0
03:26:43.426059 IP 192.168.1.11.7000 > 192.168.1.14.52174: Flags [F.], seq 1976, ack 59, win 2059, options [nop,nop,TS val 658353741 ecr 1478889432], length 0
03:26:43.430986 IP 192.168.1.14.52174 > 192.168.1.11.7000: Flags [.], ack 1977, win 2048, options [nop,nop,TS val 1478889438 ecr 658353741], length 0
03:26:43.758115 IP6 2401:4900:8900:4ecd:11c9:d418:b276:50c9.64288 > 2001:4860:4802:38::223.443: Flags [.], ack 2453761694, win 2048, length 0
03:26:43.769034 IP6 2001:4860:4802:38::223.443 > 2401:4900:8900:4ecd:11c9:d418:b276:50c9.64288: Flags [.], ack 1, win 1049, options [nop,nop,TS val 3511722555 ecr 2635430509], length 0
03:26:44.224190 IP 192.168.1.14.5353 > 224.0.0.251.5353: 0 PTR (QM)? _spotify-social-listening._tcp.local. (54)
03:26:44.224191 IP6 fe80::4fb:be99:9079:88f9.5353 > ff02::fb.5353: 0 PTR (QM)? _spotify-social-listening._tcp.local. (54)
03:26:44.324182 IP 192.168.1.8 > 224.0.0.251: igmp v2 report 224.0.0.251
03:26:44.426861 IP 192.168.1.8.5353 > 224.0.0.251.5353: 0 [2q] PTR (QU)? _rdlink._tcp.local. PTR (QU)? _companion-link._tcp.local. (58)
03:26:44.426862 IP6 fe80::1065:d6c4:dd7e:84f.5353 > ff02::fb.5353: 0 [2q] PTR (QU)? _rdlink._tcp.local. PTR (QU)? _companion-link._tcp.local. (58)
03:26:44.426863 IP6 fe80::1065:d6c4:dd7e:84f > ff02::16: HBH ICMP6, multicast listener report v2, 1 group record(s), length 28
03:26:44.426902 IP 192.168.1.8.5353 > 192.168.1.11.5353: 0 PTR (QU)? _companion-link._tcp.local. (44)
03:26:44.459200 IP 192.168.1.11.5353 > 192.168.1.8.5353: 0*- [0q] 1/0/6 PTR ROAHANM-bM-^@M-^Ys MacBook Pro._companion-link._tcp.local. (408)
03:26:44.539523 IP6 fe80::1065:d6c4:dd7e:84f.49546 > fe80::1c88:9f67:18d9:7d51.63662: Flags [P.], seq 3167862297:3167862301, ack 335282604, win 2048, options [nop,nop,TS val 3225165061 ecr 3086856947], length 4
03:26:44.539649 IP6 fe80::1c88:9f67:18d9:7d51.63662 > fe80::1065:d6c4:dd7e:84f.49546: Flags [.], ack 4, win 2092, options [nop,nop,TS val 3086866045 ecr 3225165061], length 0
03:26:44.666927 IP6 fe80::1c88:9f67:18d9:7d51.63662 > fe80::1065:d6c4:dd7e:84f.49546: Flags [.], ack 4, win 2092, length 0
03:26:44.689773 IP6 fe80::1065:d6c4:dd7e:84f.49546 > fe80::1c88:9f67:18d9:7d51.63662: Flags [.], ack 1, win 2048, options [nop,nop,TS val 3225165211 ecr 3086866045], length 0
03:26:44.733879 IP 192.168.1.8.5353 > 224.0.0.251.5353: 0 [1a] PTR (QM)? _companion-link._tcp.local. (81)
03:26:44.733880 IP6 fe80::1065:d6c4:dd7e:84f.5353 > ff02::fb.5353: 0 [1a] PTR (QM)? _companion-link._tcp.local. (81)
03:26:45.248194 IP 192.168.1.14.5353 > 224.0.0.251.5353: 0 PTR (QM)? _spotify-connect._tcp.local. (45)
03:26:45.248195 IP6 fe80::4fb:be99:9079:88f9.5353 > ff02::fb.5353: 0 PTR (QM)? _spotify-connect._tcp.local. (45)
03:26:45.296585 IP6 2401:4900:8900:4ecd:11c9:d418:b276:50c9.64290 > 2001:4860:4802:36::223.443: Flags [.], ack 2959161810, win 2048, length 0
03:26:45.309024 IP6 2001:4860:4802:36::223.443 > 2401:4900:8900:4ecd:11c9:d418:b276:50c9.64290: Flags [.], ack 1, win 1087, options [nop,nop,TS val 3067162028 ecr 824310672], length 0
03:26:45.450665 IP 192.168.1.8.5353 > 224.0.0.251.5353: 0 [1a] [2q] PTR (QM)? _rdlink._tcp.local. PTR (QM)? _companion-link._tcp.local. (95)
03:26:45.450667 IP6 fe80::1065:d6c4:dd7e:84f.5353 > ff02::fb.5353: 0 [1a] [2q] PTR (QM)? _rdlink._tcp.local. PTR (QM)? _companion-link._tcp.local. (95)
03:26:45.801711 IP6 2401:4900:8900:4ecd:11c9:d418:b276:50c9.64289 > 2001:4860:4802:36::223.443: Flags [.], ack 3818248512, win 2048, length 0
03:26:45.812474 IP6 2001:4860:4802:36::223.443 > 2401:4900:8900:4ecd:11c9:d418:b276:50c9.64289: Flags [.], ack 1, win 1077, options [nop,nop,TS val 4048482347 ecr 3560921389], length 0
03:26:46.113403 IP6 2401:4900:8900:4ecd:11c9:d418:b276:50c9.52347 > 2603:1063::77.443: Flags [P.], seq 1134886019:1134886069, ack 1818727438, win 2048, options [nop,nop,TS val 487410224 ecr 1161537478], length 50
03:26:46.216507 IP6 2603:1063::77.443 > 2401:4900:8900:4ecd:11c9:d418:b276:50c9.52347: Flags [P.], seq 1:40, ack 50, win 16381, options [nop,nop,TS val 1161576669 ecr 487410224], length 39
03:26:46.216679 IP6 2401:4900:8900:4ecd:11c9:d418:b276:50c9.52347 > 2603:1063::77.443: Flags [.], ack 40, win 2048, options [nop,nop,TS val 487410327 ecr 1161576669], length 0
03:26:46.297585 IP6 fe80::1065:d6c4:dd7e:84f > ff02::16: HBH ICMP6, multicast listener report v2, 1 group record(s), length 28
03:26:46.302417 IP6 2401:4900:8900:4ecd:11c9:d418:b276:50c9.64268 > 2404:6800:4003:c05::bc.5228: Flags [.], ack 932979365, win 2048, length 0
03:26:46.341105 IP6 2404:6800:4003:c05::bc.5228 > 2401:4900:8900:4ecd:11c9:d418:b276:50c9.64268: Flags [.], ack 1, win 1048, options [nop,nop,TS val 104176100 ecr 986661992], length 0
03:26:46.928452 IP6 2401:4900:8900:4ecd:11c9:d418:b276:50c9.52347 > 2603:1063::77.443: Flags [.], ack 40, win 2048, length 0
03:26:47.031882 IP6 2603:1063::77.443 > 2401:4900:8900:4ecd:11c9:d418:b276:50c9.52347: Flags [.], ack 50, win 16381, options [nop,nop,TS val 1161577483 ecr 487410327], length 0
03:26:47.191355 IP 192.168.1.14.5353 > 224.0.0.251.5353: 0 PTR (QM)? _spotify-connect._tcp.local. (45)
03:26:47.191357 IP6 fe80::4fb:be99:9079:88f9.5353 > ff02::fb.5353: 0 PTR (QM)? _spotify-connect._tcp.local. (45)
03:26:48.172577 IP6 fe80::1c88:9f67:18d9:7d51 > fe80::929f:22ff:fe5c:ad0a: ICMP6, neighbor solicitation, who has fe80::929f:22ff:fe5c:ad0a, length 32
03:26:48.179381 IP6 fe80::929f:22ff:fe5c:ad0a > fe80::1c88:9f67:18d9:7d51: ICMP6, neighbor advertisement, tgt is fe80::929f:22ff:fe5c:ad0a, length 24
03:26:48.420371 IP 192.168.1.8.5353 > 224.0.0.251.5353: 0 [1a] [2q] PTR (QM)? _rdlink._tcp.local. PTR (QM)? _companion-link._tcp.local. (95)
03:26:48.420373 IP6 fe80::1065:d6c4:dd7e:84f.5353 > ff02::fb.5353: 0 [1a] [2q] PTR (QM)? _rdlink._tcp.local. PTR (QM)? _companion-link._tcp.local. (95)
03:26:48.727245 IP 192.168.1.1 > 224.0.0.1: igmp query v2
03:26:49.239468 IP 192.168.1.14.5353 > 224.0.0.251.5353: 0 PTR (QM)? _spotify-connect._tcp.local. (45)
03:26:49.239470 IP6 fe80::4fb:be99:9079:88f9.5353 > ff02::fb.5353: 0 PTR (QM)? _spotify-connect._tcp.local. (45)
03:26:49.344727 IP6 2620:1ec:bdf::58.443 > 2401:4900:8900:4ecd:11c9:d418:b276:50c9.64298: Flags [FP.], seq 677826560:677826584, ack 2889802937, win 151, options [nop,nop,TS val 1263453426 ecr 3551059144], length 24
03:26:49.344786 IP6 2401:4900:8900:4ecd:11c9:d418:b276:50c9.64298 > 2620:1ec:bdf::58.443: Flags [R], seq 2889802937, win 0, length 0
03:26:50.811982 IP6 2401:4900:8900:4ecd:11c9:d418:b276:50c9.64861 > 2404:6800:4007:83c::2004.443: quic, protected
03:26:50.848040 IP6 2404:6800:4007:83c::2004.443 > 2401:4900:8900:4ecd:11c9:d418:b276:50c9.64861: quic, protected
03:26:51.185419 IP 192.168.1.14.5353 > 224.0.0.251.5353: 0 PTR (QM)? _spotify-connect._tcp.local. (45)
03:26:51.185420 IP6 fe80::4fb:be99:9079:88f9.5353 > ff02::fb.5353: 0 PTR (QM)? _spotify-connect._tcp.local. (45)
03:26:53.233077 IP 192.168.1.14.5353 > 224.0.0.251.5353: 0 PTR (QM)? _spotify-connect._tcp.local. (45)
03:26:53.233078 IP6 fe80::4fb:be99:9079:88f9.5353 > ff02::fb.5353: 0 PTR (QM)? _spotify-connect._tcp.local. (45)
03:26:53.642293 IP 192.168.1.14 > 224.0.0.251: igmp v2 report 224.0.0.251
03:26:54.567085 IP6 fe80::929f:22ff:fe5c:ad0a > ff02::1: ICMP6, router advertisement, length 136
03:26:55.179022 IP 192.168.1.14.5353 > 224.0.0.251.5353: 0 PTR (QM)? _spotify-connect._tcp.local. (45)
03:26:55.179023 IP6 fe80::4fb:be99:9079:88f9.5353 > ff02::fb.5353: 0 PTR (QM)? _spotify-connect._tcp.local. (45)
03:26:55.179143 IP6 2401:4900:8900:4ecd:11c9:d418:b276:50c9.59628 > 2606:4700:83b2:7cbc:c2fe:5:5ff2:75c4.443: quic, protected
03:26:55.191288 IP6 2606:4700:83b2:7cbc:c2fe:5:5ff2:75c4.443 > 2401:4900:8900:4ecd:11c9:d418:b276:50c9.59628: quic, protected
03:26:55.191516 IP6 2401:4900:8900:4ecd:11c9:d418:b276:50c9.59628 > 2606:4700:83b2:7cbc:c2fe:5:5ff2:75c4.443: quic, protected
03:26:55.191518 IP6 2401:4900:8900:4ecd:11c9:d418:b276:50c9.59628 > 2606:4700:83b2:7cbc:c2fe:5:5ff2:75c4.443: quic, protected
03:26:55.191519 IP6 2401:4900:8900:4ecd:11c9:d418:b276:50c9.59628 > 2606:4700:83b2:7cbc:c2fe:5:5ff2:75c4.443: quic, protected
03:26:55.191520 IP6 2401:4900:8900:4ecd:11c9:d418:b276:50c9.59628 > 2606:4700:83b2:7cbc:c2fe:5:5ff2:75c4.443: quic, protected
03:26:55.191520 IP6 2401:4900:8900:4ecd:11c9:d418:b276:50c9.59628 > 2606:4700:83b2:7cbc:c2fe:5:5ff2:75c4.443: quic, protected
03:26:55.191520 IP6 2401:4900:8900:4ecd:11c9:d418:b276:50c9.59628 > 2606:4700:83b2:7cbc:c2fe:5:5ff2:75c4.443: quic, protected
03:26:55.191521 IP6 2401:4900:8900:4ecd:11c9:d418:b276:50c9.59628 > 2606:4700:83b2:7cbc:c2fe:5:5ff2:75c4.443: quic, protected
03:26:55.191521 IP6 2401:4900:8900:4ecd:11c9:d418:b276:50c9.59628 > 2606:4700:83b2:7cbc:c2fe:5:5ff2:75c4.443: quic, protected
03:26:55.191522 IP6 2401:4900:8900:4ecd:11c9:d418:b276:50c9.59628 > 2606:4700:83b2:7cbc:c2fe:5:5ff2:75c4.443: quic, protected
03:26:55.191523 IP6 2401:4900:8900:4ecd:11c9:d418:b276:50c9.59628 > 2606:4700:83b2:7cbc:c2fe:5:5ff2:75c4.443: quic, protected
03:26:55.191523 IP6 2401:4900:8900:4ecd:11c9:d418:b276:50c9.59628 > 2606:4700:83b2:7cbc:c2fe:5:5ff2:75c4.443: quic, protected
03:26:55.191524 IP6 2401:4900:8900:4ecd:11c9:d418:b276:50c9.59628 > 2606:4700:83b2:7cbc:c2fe:5:5ff2:75c4.443: quic, protected
03:26:55.191524 IP6 2401:4900:8900:4ecd:11c9:d418:b276:50c9.59628 > 2606:4700:83b2:7cbc:c2fe:5:5ff2:75c4.443: quic, protected
03:26:55.191525 IP6 2401:4900:8900:4ecd:11c9:d418:b276:50c9.59628 > 2606:4700:83b2:7cbc:c2fe:5:5ff2:75c4.443: quic, protected
03:26:55.201563 IP6 2606:4700:83b2:7cbc:c2fe:5:5ff2:75c4.443 > 2401:4900:8900:4ecd:11c9:d418:b276:50c9.59628: quic, protected
03:26:55.201564 IP6 2606:4700:83b2:7cbc:c2fe:5:5ff2:75c4.443 > 2401:4900:8900:4ecd:11c9:d418:b276:50c9.59628: quic, protected
03:26:55.201564 IP6 2606:4700:83b2:7cbc:c2fe:5:5ff2:75c4.443 > 2401:4900:8900:4ecd:11c9:d418:b276:50c9.59628: quic, protected
03:26:55.201565 IP6 2606:4700:83b2:7cbc:c2fe:5:5ff2:75c4.443 > 2401:4900:8900:4ecd:11c9:d418:b276:50c9.59628: quic, protected
03:26:55.201565 IP6 2606:4700:83b2:7cbc:c2fe:5:5ff2:75c4.443 > 2401:4900:8900:4ecd:11c9:d418:b276:50c9.59628: quic, protected
03:26:55.201566 IP6 2606:4700:83b2:7cbc:c2fe:5:5ff2:75c4.443 > 2401:4900:8900:4ecd:11c9:d418:b276:50c9.59628: quic, protected
03:26:55.201567 IP6 2606:4700:83b2:7cbc:c2fe:5:5ff2:75c4.443 > 2401:4900:8900:4ecd:11c9:d418:b276:50c9.59628: quic, protected
03:26:55.202294 IP6 2606:4700:83b2:7cbc:c2fe:5:5ff2:75c4.443 > 2401:4900:8900:4ecd:11c9:d418:b276:50c9.59628: quic, protected
03:26:55.488796 IP6 2606:4700:83b2:7cbc:c2fe:5:5ff2:75c4.443 > 2401:4900:8900:4ecd:11c9:d418:b276:50c9.59628: quic, protected
03:26:55.489176 IP6 2401:4900:8900:4ecd:11c9:d418:b276:50c9.59628 > 2606:4700:83b2:7cbc:c2fe:5:5ff2:75c4.443: quic, protected
03:26:56.212972 IP6 2401:4900:8900:4ecd:11c9:d418:b276:50c9.59628 > 2606:4700:83b2:7cbc:c2fe:5:5ff2:75c4.443: quic, protected
03:26:56.220797 IP6 2401:4900:8900:4ecd:11c9:d418:b276:50c9.59628 > 2606:4700:83b2:7cbc:c2fe:5:5ff2:75c4.443: quic, protected
03:26:56.220881 IP6 2401:4900:8900:4ecd:11c9:d418:b276:50c9.59628 > 2606:4700:83b2:7cbc:c2fe:5:5ff2:75c4.443: quic, protected
03:26:56.220881 IP6 2401:4900:8900:4ecd:11c9:d418:b276:50c9.59628 > 2606:4700:83b2:7cbc:c2fe:5:5ff2:75c4.443: quic, protected
03:26:56.220882 IP6 2401:4900:8900:4ecd:11c9:d418:b276:50c9.59628 > 2606:4700:83b2:7cbc:c2fe:5:5ff2:75c4.443: quic, protected
03:26:56.220882 IP6 2401:4900:8900:4ecd:11c9:d418:b276:50c9.59628 > 2606:4700:83b2:7cbc:c2fe:5:5ff2:75c4.443: quic, protected
03:26:56.220883 IP6 2401:4900:8900:4ecd:11c9:d418:b276:50c9.59628 > 2606:4700:83b2:7cbc:c2fe:5:5ff2:75c4.443: quic, protected
03:26:56.220922 IP6 2401:4900:8900:4ecd:11c9:d418:b276:50c9.59628 > 2606:4700:83b2:7cbc:c2fe:5:5ff2:75c4.443: quic, protected
03:26:56.220923 IP6 2401:4900:8900:4ecd:11c9:d418:b276:50c9.59628 > 2606:4700:83b2:7cbc:c2fe:5:5ff2:75c4.443: quic, protected
03:26:56.220923 IP6 2401:4900:8900:4ecd:11c9:d418:b276:50c9.59628 > 2606:4700:83b2:7cbc:c2fe:5:5ff2:75c4.443: quic, protected
03:26:56.220924 IP6 2401:4900:8900:4ecd:11c9:d418:b276:50c9.59628 > 2606:4700:83b2:7cbc:c2fe:5:5ff2:75c4.443: quic, protected
03:26:56.220924 IP6 2401:4900:8900:4ecd:11c9:d418:b276:50c9.59628 > 2606:4700:83b2:7cbc:c2fe:5:5ff2:75c4.443: quic, protected
03:26:56.220925 IP6 2401:4900:8900:4ecd:11c9:d418:b276:50c9.59628 > 2606:4700:83b2:7cbc:c2fe:5:5ff2:75c4.443: quic, protected
03:26:56.226371 IP6 2606:4700:83b2:7cbc:c2fe:5:5ff2:75c4.443 > 2401:4900:8900:4ecd:11c9:d418:b276:50c9.59628: quic, protected
03:26:56.229354 IP6 2606:4700:83b2:7cbc:c2fe:5:5ff2:75c4.443 > 2401:4900:8900:4ecd:11c9:d418:b276:50c9.59628: quic, protected
03:26:56.230387 IP6 2606:4700:83b2:7cbc:c2fe:5:5ff2:75c4.443 > 2401:4900:8900:4ecd:11c9:d418:b276:50c9.59628: quic, protected
03:26:56.230387 IP6 2606:4700:83b2:7cbc:c2fe:5:5ff2:75c4.443 > 2401:4900:8900:4ecd:11c9:d418:b276:50c9.59628: quic, protected
03:26:56.230388 IP6 2606:4700:83b2:7cbc:c2fe:5:5ff2:75c4.443 > 2401:4900:8900:4ecd:11c9:d418:b276:50c9.59628: quic, protected
03:26:56.232329 IP6 2606:4700:83b2:7cbc:c2fe:5:5ff2:75c4.443 > 2401:4900:8900:4ecd:11c9:d418:b276:50c9.59628: quic, protected
03:26:56.514528 IP6 2606:4700:83b2:7cbc:c2fe:5:5ff2:75c4.443 > 2401:4900:8900:4ecd:11c9:d418:b276:50c9.59628: quic, protected
03:26:56.514529 IP6 2606:4700:83b2:7cbc:c2fe:5:5ff2:75c4.443 > 2401:4900:8900:4ecd:11c9:d418:b276:50c9.59628: quic, protected
03:26:56.514530 IP6 2606:4700:83b2:7cbc:c2fe:5:5ff2:75c4.443 > 2401:4900:8900:4ecd:11c9:d418:b276:50c9.59628: quic, protected
03:26:56.514531 IP6 2606:4700:83b2:7cbc:c2fe:5:5ff2:75c4.443 > 2401:4900:8900:4ecd:11c9:d418:b276:50c9.59628: quic, protected
03:26:56.515036 IP6 2401:4900:8900:4ecd:11c9:d418:b276:50c9.59628 > 2606:4700:83b2:7cbc:c2fe:5:5ff2:75c4.443: quic, protected
03:26:57.226815 IP 192.168.1.14.5353 > 224.0.0.251.5353: 0 PTR (QM)? _spotify-connect._tcp.local. (45)
03:26:57.226816 IP6 fe80::4fb:be99:9079:88f9.5353 > ff02::fb.5353: 0 PTR (QM)? _spotify-connect._tcp.local. (45)
03:26:58.345688 IP6 2401:4900:8900:4ecd:11c9:d418:b276:50c9.64281 > 2606:4700:83b2:b6b1:3b:5:ac42:857c.443: Flags [.], ack 733121779, win 2048, length 0
03:26:58.356357 IP6 2606:4700:83b2:b6b1:3b:5:ac42:857c.443 > 2401:4900:8900:4ecd:11c9:d418:b276:50c9.64281: Flags [.], ack 1, win 16, options [nop,nop,TS val 1176852620 ecr 1564139791], length 0
03:26:58.846762 IP6 2401:4900:8900:4ecd:11c9:d418:b276:50c9.64288 > 2001:4860:4802:38::223.443: Flags [.], ack 1, win 2048, length 0
03:26:58.860039 IP6 2001:4860:4802:38::223.443 > 2401:4900:8900:4ecd:11c9:d418:b276:50c9.64288: Flags [.], ack 1, win 1049, options [nop,nop,TS val 3511737646 ecr 2635430509], length 0
03:26:58.958018 IP 192.168.1.11.63880 > 34.54.84.110.443: Flags [P.], seq 1087885154:1087885199, ack 4064233352, win 2048, options [nop,nop,TS val 2741139839 ecr 2465896917], length 45
03:26:58.965963 IP 34.54.84.110.443 > 192.168.1.11.63880: Flags [.], ack 45, win 1044, options [nop,nop,TS val 2465926634 ecr 2741139839], length 0
03:26:59.172715 IP 192.168.1.14.5353 > 224.0.0.251.5353: 0 PTR (QM)? _spotify-connect._tcp.local. (45)
03:26:59.172716 IP6 fe80::4fb:be99:9079:88f9.5353 > ff02::fb.5353: 0 PTR (QM)? _spotify-connect._tcp.local. (45)
03:26:59.275582 IP 34.54.84.110.443 > 192.168.1.11.63880: Flags [P.], seq 1:78, ack 45, win 1044, options [nop,nop,TS val 2465926892 ecr 2741139839], length 77
03:26:59.275653 IP 192.168.1.11.63880 > 34.54.84.110.443: Flags [.], ack 78, win 2047, options [nop,nop,TS val 2741140156 ecr 2465926892], length 0
03:26:59.275773 IP 192.168.1.11.63880 > 34.54.84.110.443: Flags [P.], seq 45:84, ack 78, win 2048, options [nop,nop,TS val 2741140156 ecr 2465926892], length 39
03:26:59.283723 IP 34.54.84.110.443 > 192.168.1.11.63880: Flags [.], ack 84, win 1044, options [nop,nop,TS val 2465926952 ecr 2741140156], length 0
03:27:00.795647 IP6 2401:4900:8900:4ecd:11c9:d418:b276:50c9.64290 > 2001:4860:4802:36::223.443: Flags [.], ack 1, win 2048, length 0
03:27:00.807377 IP6 2001:4860:4802:36::223.443 > 2401:4900:8900:4ecd:11c9:d418:b276:50c9.64290: Flags [.], ack 1, win 1087, options [nop,nop,TS val 3067177527 ecr 824310672], length 0
03:27:00.848341 IP6 2401:4900:8900:4ecd:11c9:d418:b276:50c9.64289 > 2001:4860:4802:36::223.443: Flags [.], ack 1, win 2048, length 0
03:27:00.857126 IP6 2001:4860:4802:36::223.443 > 2401:4900:8900:4ecd:11c9:d418:b276:50c9.64289: Flags [.], ack 1, win 1077, options [nop,nop,TS val 4048497391 ecr 3560921389], length 0
03:27:01.220442 IP 192.168.1.14.5353 > 224.0.0.251.5353: 0 PTR (QM)? _spotify-connect._tcp.local. (45)
03:27:01.220443 IP6 fe80::4fb:be99:9079:88f9.5353 > ff02::fb.5353: 0 PTR (QM)? _spotify-connect._tcp.local. (45)
03:27:02.155749 IP6 2401:4900:8900:4ecd:11c9:d418:b276:50c9.59628 > 2606:4700:83b2:7cbc:c2fe:5:5ff2:75c4.443: quic, protected
03:27:02.155820 IP6 2401:4900:8900:4ecd:11c9:d418:b276:50c9.59628 > 2606:4700:83b2:7cbc:c2fe:5:5ff2:75c4.443: quic, protected
03:27:02.155821 IP6 2401:4900:8900:4ecd:11c9:d418:b276:50c9.59628 > 2606:4700:83b2:7cbc:c2fe:5:5ff2:75c4.443: quic, protected
03:27:02.155821 IP6 2401:4900:8900:4ecd:11c9:d418:b276:50c9.59628 > 2606:4700:83b2:7cbc:c2fe:5:5ff2:75c4.443: quic, protected
03:27:02.155821 IP6 2401:4900:8900:4ecd:11c9:d418:b276:50c9.59628 > 2606:4700:83b2:7cbc:c2fe:5:5ff2:75c4.443: quic, protected
03:27:02.167780 IP6 2606:4700:83b2:7cbc:c2fe:5:5ff2:75c4.443 > 2401:4900:8900:4ecd:11c9:d418:b276:50c9.59628: quic, protected
03:27:02.167781 IP6 2606:4700:83b2:7cbc:c2fe:5:5ff2:75c4.443 > 2401:4900:8900:4ecd:11c9:d418:b276:50c9.59628: quic, protected
03:27:02.168528 IP6 2606:4700:83b2:7cbc:c2fe:5:5ff2:75c4.443 > 2401:4900:8900:4ecd:11c9:d418:b276:50c9.59628: quic, protected
03:27:02.346530 IP6 2606:4700:83b2:7cbc:c2fe:5:5ff2:75c4.443 > 2401:4900:8900:4ecd:11c9:d418:b276:50c9.59628: quic, protected
03:27:02.374005 IP6 2401:4900:8900:4ecd:11c9:d418:b276:50c9.59628 > 2606:4700:83b2:7cbc:c2fe:5:5ff2:75c4.443: quic, protected
03:27:03.064492 IP6 2620:1ec:bdf::58.443 > 2401:4900:8900:4ecd:11c9:d418:b276:50c9.64298: Flags [FP.], seq 0:24, ack 1, win 151, options [nop,nop,TS val 1263467246 ecr 3551059144], length 24
03:27:03.064561 IP6 2401:4900:8900:4ecd:11c9:d418:b276:50c9.64298 > 2620:1ec:bdf::58.443: Flags [R], seq 2889802937, win 0, length 0
03:27:03.268459 IP 192.168.1.14.5353 > 224.0.0.251.5353: 0 PTR (QM)? _spotify-connect._tcp.local. (45)
03:27:03.268460 IP6 fe80::4fb:be99:9079:88f9.5353 > ff02::fb.5353: 0 PTR (QM)? _spotify-connect._tcp.local. (45)
03:27:03.780489 IP 192.168.1.1 > 224.0.0.1: igmp query v2
03:27:05.214313 IP 192.168.1.14.5353 > 224.0.0.251.5353: 0 PTR (QM)? _spotify-connect._tcp.local. (45)
03:27:05.214314 IP6 fe80::4fb:be99:9079:88f9.5353 > ff02::fb.5353: 0 PTR (QM)? _spotify-connect._tcp.local. (45)
03:27:06.861473 IP 192.168.1.11 > 224.0.0.251: igmp v2 report 224.0.0.251
03:27:07.262078 IP 192.168.1.14.5353 > 224.0.0.251.5353: 0 PTR (QM)? _spotify-connect._tcp.local. (45)
03:27:07.262079 IP6 fe80::4fb:be99:9079:88f9.5353 > ff02::fb.5353: 0 PTR (QM)? _spotify-connect._tcp.local. (45)
03:27:09.207880 IP 192.168.1.14.5353 > 224.0.0.251.5353: 0 PTR (QM)? _spotify-connect._tcp.local. (45)
03:27:09.207881 IP6 fe80::4fb:be99:9079:88f9.5353 > ff02::fb.5353: 0 PTR (QM)? _spotify-connect._tcp.local. (45)
03:27:11.255745 IP 192.168.1.14.5353 > 224.0.0.251.5353: 0 PTR (QM)? _spotify-connect._tcp.local. (45)
03:27:11.255747 IP6 fe80::4fb:be99:9079:88f9.5353 > ff02::fb.5353: 0 PTR (QM)? _spotify-connect._tcp.local. (45)
03:27:13.201556 IP 192.168.1.14.5353 > 224.0.0.251.5353: 0 PTR (QM)? _spotify-connect._tcp.local. (45)
03:27:13.201557 IP6 fe80::4fb:be99:9079:88f9.5353 > ff02::fb.5353: 0 PTR (QM)? _spotify-connect._tcp.local. (45)
03:27:13.816099 IP 192.168.1.14.5353 > 224.0.0.251.5353: 0 [3q] PTR (QU)? _spotify-social-listening._tcp.local. PTR (QU)? _googlecast._tcp.local. PTR (QU)? _CC32E753._sub._googlecast._tcp.local. (93)
03:27:13.816101 IP6 fe80::4fb:be99:9079:88f9.5353 > ff02::fb.5353: 0 [3q] PTR (QU)? _spotify-social-listening._tcp.local. PTR (QU)? _googlecast._tcp.local. PTR (QU)? _CC32E753._sub._googlecast._tcp.local. (93)
03:27:13.818253 IP 192.168.1.14.52175 > 192.168.1.11.7000: Flags [SEW], seq 4273985121, win 65535, options [mss 1460,nop,wscale 6,nop,nop,TS val 680152570 ecr 0,sackOK,eol], length 0
03:27:13.818472 IP 192.168.1.11.7000 > 192.168.1.14.52175: Flags [S.E], seq 3338019542, ack 4273985122, win 65535, options [mss 1460,nop,wscale 6,nop,nop,TS val 202133585 ecr 680152570,sackOK,eol], length 0
03:27:13.825595 IP 192.168.1.14.52175 > 192.168.1.11.7000: Flags [.], ack 1, win 2059, options [nop,nop,TS val 680152665 ecr 202133585], length 0
03:27:13.825682 IP 192.168.1.11.7000 > 192.168.1.14.52175: Flags [.], ack 1, win 2059, options [nop,nop,TS val 202133592 ecr 680152665], length 0
03:27:13.827853 IP 192.168.1.14.52175 > 192.168.1.11.7000: Flags [P.], seq 1:58, ack 1, win 2059, options [nop,nop,TS val 680152666 ecr 202133585], length 57
03:27:13.827923 IP 192.168.1.11.7000 > 192.168.1.14.52175: Flags [.], ack 58, win 2059, options [nop,nop,TS val 202133595 ecr 680152666], length 0
03:27:13.835015 IP 192.168.1.11.7000 > 192.168.1.14.52175: Flags [.], seq 1:1449, ack 58, win 2059, options [nop,nop,TS val 202133602 ecr 680152666], length 1448
03:27:13.835061 IP 192.168.1.11.7000 > 192.168.1.14.52175: Flags [P.], seq 1449:1976, ack 58, win 2059, options [nop,nop,TS val 202133602 ecr 680152666], length 527
03:27:13.843435 IP 192.168.1.14.52175 > 192.168.1.11.7000: Flags [.], ack 1976, win 2029, options [nop,nop,TS val 680152682 ecr 202133602], length 0
03:27:13.843436 IP 192.168.1.14.52175 > 192.168.1.11.7000: Flags [F.], seq 58, ack 1976, win 2048, options [nop,nop,TS val 680152683 ecr 202133602], length 0
03:27:13.843495 IP 192.168.1.11.7000 > 192.168.1.14.52175: Flags [.], ack 59, win 2059, options [nop,nop,TS val 202133610 ecr 680152683], length 0
03:27:13.843551 IP 192.168.1.11.7000 > 192.168.1.14.52175: Flags [F.], seq 1976, ack 59, win 2059, options [nop,nop,TS val 202133610 ecr 680152683], length 0
03:27:13.850315 IP 192.168.1.14.52175 > 192.168.1.11.7000: Flags [.], ack 1977, win 2048, options [nop,nop,TS val 680152690 ecr 202133610], length 0
03:27:13.860885 IP6 2401:4900:8900:4ecd:11c9:d418:b276:50c9.64288 > 2001:4860:4802:38::223.443: Flags [.], ack 1, win 2048, length 0
03:27:13.870633 IP6 2001:4860:4802:38::223.443 > 2401:4900:8900:4ecd:11c9:d418:b276:50c9.64288: Flags [.], ack 1, win 1049, options [nop,nop,TS val 3511752655 ecr 2635430509], length 0
03:27:13.921251 IP 192.168.1.14.5353 > 224.0.0.251.5353: 0 PTR (QM)? _spotify-connect._tcp.local. (45)
03:27:13.921253 IP6 fe80::4fb:be99:9079:88f9.5353 > ff02::fb.5353: 0 PTR (QM)? _spotify-connect._tcp.local. (45)
03:27:14.839926 IP 192.168.1.14.5353 > 224.0.0.251.5353: 0 [3q] PTR (QM)? _spotify-social-listening._tcp.local. PTR (QM)? _googlecast._tcp.local. PTR (QM)? _CC32E753._sub._googlecast._tcp.local. (93)
03:27:14.839927 IP6 fe80::4fb:be99:9079:88f9.5353 > ff02::fb.5353: 0 [3q] PTR (QM)? _spotify-social-listening._tcp.local. PTR (QM)? _googlecast._tcp.local. PTR (QM)? _CC32E753._sub._googlecast._tcp.local. (93)
03:27:14.941977 IP 192.168.1.8 > 224.0.0.251: igmp v2 report 224.0.0.251
03:27:14.942473 IP 192.168.1.8.5353 > 224.0.0.251.5353: 0 [2q] PTR (QU)? _rdlink._tcp.local. PTR (QU)? _companion-link._tcp.local. (58)
03:27:14.942474 IP6 fe80::1065:d6c4:dd7e:84f.5353 > ff02::fb.5353: 0 [2q] PTR (QU)? _rdlink._tcp.local. PTR (QU)? _companion-link._tcp.local. (58)
03:27:14.946874 IP 192.168.1.8.5353 > 192.168.1.11.5353: 0 PTR (QU)? _companion-link._tcp.local. (44)
03:27:15.065649 ARP, Request who-has 192.168.1.8 (66:bf:5e:49:a2:ab) tell 192.168.1.11, length 28
03:27:15.065652 IP 192.168.1.11.5353 > 192.168.1.8.5353: 0*- [0q] 1/0/6 PTR ROAHANM-bM-^@M-^Ys MacBook Pro._companion-link._tcp.local. (408)
03:27:15.072406 ARP, Reply 192.168.1.8 is-at 66:bf:5e:49:a2:ab, length 28
03:27:15.076589 IP6 fe80::1065:d6c4:dd7e:84f.49546 > fe80::1c88:9f67:18d9:7d51.63662: Flags [P.], seq 4:8, ack 1, win 2048, options [nop,nop,TS val 3225172720 ecr 3086866045], length 4
03:27:15.076711 IP6 fe80::1c88:9f67:18d9:7d51.63662 > fe80::1065:d6c4:dd7e:84f.49546: Flags [.], ack 8, win 2092, options [nop,nop,TS val 3086896582 ecr 3225172720], length 0
03:27:15.199418 IP6 fe80::1c88:9f67:18d9:7d51.63662 > fe80::1065:d6c4:dd7e:84f.49546: Flags [.], ack 8, win 2092, length 0
03:27:15.207353 IP6 fe80::1065:d6c4:dd7e:84f.49546 > fe80::1c88:9f67:18d9:7d51.63662: Flags [.], ack 1, win 2048, options [nop,nop,TS val 3225172850 ecr 3086896582], length 0
03:27:15.249393 IP 192.168.1.8.5353 > 224.0.0.251.5353: 0 [1a] PTR (QM)? _companion-link._tcp.local. (81)
03:27:15.249395 IP6 fe80::1065:d6c4:dd7e:84f.5353 > ff02::fb.5353: 0 [1a] PTR (QM)? _companion-link._tcp.local. (81)
03:27:15.905713 IP6 2401:4900:8900:4ecd:11c9:d418:b276:50c9.64290 > 2001:4860:4802:36::223.443: Flags [.], ack 1, win 2048, length 0
03:27:15.905740 IP6 2401:4900:8900:4ecd:11c9:d418:b276:50c9.64289 > 2001:4860:4802:36::223.443: Flags [.], ack 1, win 2048, length 0
03:27:15.918908 IP6 2001:4860:4802:36::223.443 > 2401:4900:8900:4ecd:11c9:d418:b276:50c9.64289: Flags [.], ack 1, win 1077, options [nop,nop,TS val 4048512454 ecr 3560921389], length 0
03:27:15.918909 IP6 2001:4860:4802:36::223.443 > 2401:4900:8900:4ecd:11c9:d418:b276:50c9.64290: Flags [.], ack 1, win 1087, options [nop,nop,TS val 3067192639 ecr 824310672], length 0
03:27:15.968629 IP 192.168.1.14.5353 > 224.0.0.251.5353: 0 PTR (QM)? _spotify-connect._tcp.local. (45)
03:27:15.968630 IP6 fe80::4fb:be99:9079:88f9.5353 > ff02::fb.5353: 0 PTR (QM)? _spotify-connect._tcp.local. (45)
03:27:16.963758 IP6 2401:4900:8900:4ecd:11c9:d418:b276:50c9.57018 > 2401:4900:50:9::280.53: 21819+ AAAA? mmx-ds.cdn.whatsapp.net. (41)
03:27:16.963925 IP6 2401:4900:8900:4ecd:11c9:d418:b276:50c9.63389 > 2401:4900:50:9::280.53: 60+ A? mmx-ds.cdn.whatsapp.net. (41)
03:27:16.964475 IP6 2401:4900:8900:4ecd:11c9:d418:b276:50c9.52394 > 2a03:2880:f36a:120:face:b00c:0:167.443: Flags [SEW], seq 3233724701, win 65535, options [mss 1420,nop,wscale 6,nop,nop,TS val 1341369111 ecr 0,sackOK,eol], length 0
03:27:16.975507 IP6 2401:4900:50:9::280.53 > 2401:4900:8900:4ecd:11c9:d418:b276:50c9.57018: 21819 1/0/0 AAAA 2a03:2880:f36a:120:face:b00c:0:167 (69)
03:27:16.975508 IP6 2401:4900:50:9::280.53 > 2401:4900:8900:4ecd:11c9:d418:b276:50c9.63389: 60 1/0/0 A 57.144.213.32 (57)
03:27:16.976435 IP6 2a03:2880:f36a:120:face:b00c:0:167.443 > 2401:4900:8900:4ecd:11c9:d418:b276:50c9.52394: Flags [S.], seq 93984657, ack 3233724702, win 65535, options [mss 1380,sackOK,TS val 2183570318 ecr 1341369111,nop,wscale 8], length 0
03:27:16.976896 IP6 2401:4900:8900:4ecd:11c9:d418:b276:50c9.52394 > 2a03:2880:f36a:120:face:b00c:0:167.443: Flags [.], ack 1, win 2052, options [nop,nop,TS val 1341369123 ecr 2183570318], length 0
03:27:16.976912 IP6 2401:4900:8900:4ecd:11c9:d418:b276:50c9.52394 > 2a03:2880:f36a:120:face:b00c:0:167.443: Flags [.], seq 1:1369, ack 1, win 2052, options [nop,nop,TS val 1341369124 ecr 2183570318], length 1368
03:27:16.976914 IP6 2401:4900:8900:4ecd:11c9:d418:b276:50c9.52394 > 2a03:2880:f36a:120:face:b00c:0:167.443: Flags [P.], seq 1369:1542, ack 1, win 2052, options [nop,nop,TS val 1341369124 ecr 2183570318], length 173
03:27:16.985458 IP6 2a03:2880:f36a:120:face:b00c:0:167.443 > 2401:4900:8900:4ecd:11c9:d418:b276:50c9.52394: Flags [.], ack 1, win 261, options [nop,nop,TS val 2183570327 ecr 1341369111,nop,nop,sack 1 {1369:1542}], length 0
03:27:16.985459 IP6 2a03:2880:f36a:120:face:b00c:0:167.443 > 2401:4900:8900:4ecd:11c9:d418:b276:50c9.52394: Flags [.], ack 1542, win 271, options [nop,nop,TS val 2183570327 ecr 1341369124], length 0
03:27:16.985514 IP6 2401:4900:8900:4ecd:11c9:d418:b276:50c9.52394 > 2a03:2880:f36a:120:face:b00c:0:167.443: Flags [.], seq 1:1369, ack 1, win 2052, options [nop,nop,TS val 1341369132 ecr 2183570327], length 1368
03:27:16.986357 IP6 2a03:2880:f36a:120:face:b00c:0:167.443 > 2401:4900:8900:4ecd:11c9:d418:b276:50c9.52394: Flags [.], seq 1:1219, ack 1542, win 271, options [nop,nop,TS val 2183570328 ecr 1341369124], length 1218
03:27:16.986358 IP6 2a03:2880:f36a:120:face:b00c:0:167.443 > 2401:4900:8900:4ecd:11c9:d418:b276:50c9.52394: Flags [P.], seq 1219:2437, ack 1542, win 271, options [nop,nop,TS val 2183570328 ecr 1341369124], length 1218
03:27:16.986359 IP6 2a03:2880:f36a:120:face:b00c:0:167.443 > 2401:4900:8900:4ecd:11c9:d418:b276:50c9.52394: Flags [P.], seq 2437:3504, ack 1542, win 271, options [nop,nop,TS val 2183570328 ecr 1341369124], length 1067
03:27:16.986786 IP6 2401:4900:8900:4ecd:11c9:d418:b276:50c9.52394 > 2a03:2880:f36a:120:face:b00c:0:167.443: Flags [.], ack 3504, win 1998, options [nop,nop,TS val 1341369133 ecr 2183570328], length 0
03:27:16.986788 IP6 2401:4900:8900:4ecd:11c9:d418:b276:50c9.52394 > 2a03:2880:f36a:120:face:b00c:0:167.443: Flags [.], ack 3504, win 2048, options [nop,nop,TS val 1341369133 ecr 2183570328], length 0
03:27:16.993518 IP6 2a03:2880:f36a:120:face:b00c:0:167.443 > 2401:4900:8900:4ecd:11c9:d418:b276:50c9.52394: Flags [.], ack 1542, win 271, options [nop,nop,TS val 2183570334 ecr 1341369124], length 0
03:27:16.995547 IP6 2401:4900:8900:4ecd:11c9:d418:b276:50c9.52394 > 2a03:2880:f36a:120:face:b00c:0:167.443: Flags [P.], seq 1542:1606, ack 3504, win 2048, options [nop,nop,TS val 1341369142 ecr 2183570334], length 64
03:27:16.996321 IP6 2401:4900:8900:4ecd:11c9:d418:b276:50c9.52394 > 2a03:2880:f36a:120:face:b00c:0:167.443: Flags [P.], seq 1606:1996, ack 3504, win 2048, options [nop,nop,TS val 1341369143 ecr 2183570334], length 390
03:27:16.996433 IP6 2401:4900:8900:4ecd:11c9:d418:b276:50c9.52394 > 2a03:2880:f36a:120:face:b00c:0:167.443: Flags [P.], seq 1996:2261, ack 3504, win 2048, options [nop,nop,TS val 1341369143 ecr 2183570334], length 265
03:27:17.003550 IP6 2a03:2880:f36a:120:face:b00c:0:167.443 > 2401:4900:8900:4ecd:11c9:d418:b276:50c9.52394: Flags [.], ack 1542, win 282, options [nop,nop,TS val 2183570345 ecr 1341369133,nop,nop,sack 1 {1606:1996}], length 0
03:27:17.003551 IP6 2a03:2880:f36a:120:face:b00c:0:167.443 > 2401:4900:8900:4ecd:11c9:d418:b276:50c9.52394: Flags [.], ack 1996, win 282, options [nop,nop,TS val 2183570345 ecr 1341369142], length 0
03:27:17.003609 IP6 2401:4900:8900:4ecd:11c9:d418:b276:50c9.52394 > 2a03:2880:f36a:120:face:b00c:0:167.443: Flags [.], seq 1542:1606, ack 3504, win 2048, options [nop,nop,TS val 1341369150 ecr 2183570345], length 64
03:27:17.004437 IP6 2a03:2880:f36a:120:face:b00c:0:167.443 > 2401:4900:8900:4ecd:11c9:d418:b276:50c9.52394: Flags [P.], seq 3504:3683, ack 1996, win 282, options [nop,nop,TS val 2183570346 ecr 1341369142], length 179
03:27:17.004438 IP6 2a03:2880:f36a:120:face:b00c:0:167.443 > 2401:4900:8900:4ecd:11c9:d418:b276:50c9.52394: Flags [P.], seq 3683:3757, ack 1996, win 282, options [nop,nop,TS val 2183570346 ecr 1341369142], length 74
03:27:17.004439 IP6 2a03:2880:f36a:120:face:b00c:0:167.443 > 2401:4900:8900:4ecd:11c9:d418:b276:50c9.52394: Flags [P.], seq 3757:3801, ack 1996, win 282, options [nop,nop,TS val 2183570346 ecr 1341369142], length 44
03:27:17.004565 IP6 2401:4900:8900:4ecd:11c9:d418:b276:50c9.52394 > 2a03:2880:f36a:120:face:b00c:0:167.443: Flags [.], ack 3801, win 2044, options [nop,nop,TS val 1341369151 ecr 2183570346], length 0
03:27:17.004611 IP6 2401:4900:8900:4ecd:11c9:d418:b276:50c9.52394 > 2a03:2880:f36a:120:face:b00c:0:167.443: Flags [P.], seq 2261:2292, ack 3801, win 2048, options [nop,nop,TS val 1341369151 ecr 2183570346], length 31
03:27:17.011513 IP6 2a03:2880:f36a:120:face:b00c:0:167.443 > 2401:4900:8900:4ecd:11c9:d418:b276:50c9.52394: Flags [.], ack 2261, win 293, options [nop,nop,TS val 2183570353 ecr 1341369143], length 0
03:27:17.011513 IP6 2a03:2880:f36a:120:face:b00c:0:167.443 > 2401:4900:8900:4ecd:11c9:d418:b276:50c9.52394: Flags [.], ack 2292, win 293, options [nop,nop,TS val 2183570354 ecr 1341369151], length 0
03:27:17.213156 IP6 2a03:2880:f36a:120:face:b00c:0:167.443 > 2401:4900:8900:4ecd:11c9:d418:b276:50c9.52394: Flags [P.], seq 3801:4280, ack 2292, win 293, options [nop,nop,TS val 2183570555 ecr 1341369151], length 479
03:27:17.213295 IP6 2401:4900:8900:4ecd:11c9:d418:b276:50c9.52394 > 2a03:2880:f36a:120:face:b00c:0:167.443: Flags [.], ack 4280, win 2041, options [nop,nop,TS val 1341369360 ecr 2183570555], length 0
03:27:17.215174 IP6 2401:4900:8900:4ecd:11c9:d418:b276:50c9.52394 > 2a03:2880:f36a:120:face:b00c:0:167.443: Flags [P.], seq 2292:2331, ack 4280, win 2048, options [nop,nop,TS val 1341369362 ecr 2183570555], length 39
03:27:17.215310 IP6 2401:4900:8900:4ecd:11c9:d418:b276:50c9.52394 > 2a03:2880:f36a:120:face:b00c:0:167.443: Flags [P.], seq 2331:2355, ack 4280, win 2048, options [nop,nop,TS val 1341369362 ecr 2183570555], length 24
03:27:17.215450 IP6 2401:4900:8900:4ecd:11c9:d418:b276:50c9.52394 > 2a03:2880:f36a:120:face:b00c:0:167.443: Flags [F.], seq 2355, ack 4280, win 2048, options [nop,nop,TS val 1341369362 ecr 2183570555], length 0
03:27:17.227237 IP6 2a03:2880:f36a:120:face:b00c:0:167.443 > 2401:4900:8900:4ecd:11c9:d418:b276:50c9.52394: Flags [.], ack 2331, win 293, options [nop,nop,TS val 2183570563 ecr 1341369362], length 0
03:27:17.227238 IP6 2a03:2880:f36a:120:face:b00c:0:167.443 > 2401:4900:8900:4ecd:11c9:d418:b276:50c9.52394: Flags [P.], seq 4280:4319, ack 2331, win 293, options [nop,nop,TS val 2183570563 ecr 1341369362], length 39
03:27:17.227238 IP6 2a03:2880:f36a:120:face:b00c:0:167.443 > 2401:4900:8900:4ecd:11c9:d418:b276:50c9.52394: Flags [.], ack 2331, win 293, options [nop,nop,TS val 2183570567 ecr 1341369362,nop,nop,sack 1 {2355:2356}], length 0
03:27:17.227239 IP6 2a03:2880:f36a:120:face:b00c:0:167.443 > 2401:4900:8900:4ecd:11c9:d418:b276:50c9.52394: Flags [.], ack 2356, win 293, options [nop,nop,TS val 2183570567 ecr 1341369362], length 0
03:27:17.227239 IP6 2a03:2880:f36a:120:face:b00c:0:167.443 > 2401:4900:8900:4ecd:11c9:d418:b276:50c9.52394: Flags [P.], seq 4319:4343, ack 2356, win 293, options [nop,nop,TS val 2183570567 ecr 1341369362], length 24
03:27:17.227240 IP6 2a03:2880:f36a:120:face:b00c:0:167.443 > 2401:4900:8900:4ecd:11c9:d418:b276:50c9.52394: Flags [F.], seq 4343, ack 2356, win 293, options [nop,nop,TS val 2183570567 ecr 1341369362], length 0
03:27:17.227311 IP6 2401:4900:8900:4ecd:11c9:d418:b276:50c9.52394 > 2a03:2880:f36a:120:face:b00c:0:167.443: Flags [R], seq 3233727032, win 0, length 0
03:27:17.227313 IP6 2401:4900:8900:4ecd:11c9:d418:b276:50c9.52394 > 2a03:2880:f36a:120:face:b00c:0:167.443: Flags [R], seq 3233727032, win 0, length 0
03:27:17.227313 IP6 2401:4900:8900:4ecd:11c9:d418:b276:50c9.52394 > 2a03:2880:f36a:120:face:b00c:0:167.443: Flags [R], seq 3233727057, win 0, length 0
03:27:17.227313 IP6 2401:4900:8900:4ecd:11c9:d418:b276:50c9.52394 > 2a03:2880:f36a:120:face:b00c:0:167.443: Flags [R], seq 3233727057, win 0, length 0
03:27:17.810119 IP 192.168.1.14.5353 > 224.0.0.251.5353: 0 [3q] PTR (QM)? _spotify-social-listening._tcp.local. PTR (QM)? _googlecast._tcp.local. PTR (QM)? _CC32E753._sub._googlecast._tcp.local. (93)
03:27:17.810121 IP6 fe80::4fb:be99:9079:88f9.5353 > ff02::fb.5353: 0 [3q] PTR (QM)? _spotify-social-listening._tcp.local. PTR (QM)? _googlecast._tcp.local. PTR (QM)? _CC32E753._sub._googlecast._tcp.local. (93)
03:27:17.815153 IP6 2401:4900:8900:4ecd:11c9:d418:b276:50c9.64861 > 2404:6800:4007:83c::2004.443: quic, protected
03:27:17.850502 IP6 2404:6800:4007:83c::2004.443 > 2401:4900:8900:4ecd:11c9:d418:b276:50c9.64861: quic, protected
03:27:17.911809 IP 192.168.1.14.5353 > 224.0.0.251.5353: 0 PTR (QM)? _spotify-connect._tcp.local. (45)
03:27:17.911810 IP6 fe80::4fb:be99:9079:88f9.5353 > ff02::fb.5353: 0 PTR (QM)? _spotify-connect._tcp.local. (45)
03:27:18.513912 IP6 2401:4900:8900:4ecd:11c9:d418:b276:50c9.64309 > 2404:6800:4007:802::2003.443: Flags [.], ack 4077713818, win 2048, length 0
03:27:18.526142 IP6 2404:6800:4007:802::2003.443 > 2401:4900:8900:4ecd:11c9:d418:b276:50c9.64309: Flags [.], ack 1, win 1088, options [nop,nop,TS val 3376591669 ecr 557587726], length 0
03:27:18.833146 IP 192.168.1.1 > 224.0.0.1: igmp query v2
03:27:18.915019 IP6 fe80::1c88:9f67:18d9:7d51 > fe80::929f:22ff:fe5c:ad0a: ICMP6, neighbor solicitation, who has fe80::929f:22ff:fe5c:ad0a, length 32
03:27:18.921227 IP6 fe80::929f:22ff:fe5c:ad0a > fe80::1c88:9f67:18d9:7d51: ICMP6, neighbor advertisement, tgt is fe80::929f:22ff:fe5c:ad0a, length 24
03:27:18.935825 IP 192.168.1.8.5353 > 224.0.0.251.5353: 0 [1a] [2q] PTR (QM)? _rdlink._tcp.local. PTR (QM)? _companion-link._tcp.local. (95)
03:27:18.935826 IP6 fe80::1065:d6c4:dd7e:84f.5353 > ff02::fb.5353: 0 [1a] [2q] PTR (QM)? _rdlink._tcp.local. PTR (QM)? _companion-link._tcp.local. (95)
03:27:19.857762 IP 192.168.1.14.5353 > 224.0.0.251.5353: 0 PTR (QM)? _spotify-connect._tcp.local. (45)
03:27:19.926098 IP6 fe80::1c88:9f67:18d9:7d51 > fe80::1065:d6c4:dd7e:84f: ICMP6, neighbor solicitation, who has fe80::1065:d6c4:dd7e:84f, length 32
03:27:19.959735 IP6 fe80::4fb:be99:9079:88f9.5353 > ff02::fb.5353: 0 PTR (QM)? _spotify-connect._tcp.local. (45)
03:27:19.968564 IP6 fe80::1065:d6c4:dd7e:84f > fe80::1c88:9f67:18d9:7d51: ICMP6, neighbor advertisement, tgt is fe80::1065:d6c4:dd7e:84f, length 24
03:27:20.719886 IP 192.168.1.11.64278 > 20.189.173.4.443: Flags [.], ack 1920194432, win 2048, length 0
03:27:21.088930 IP 20.189.173.4.443 > 192.168.1.11.64278: Flags [.], ack 1, win 16384, options [nop,nop,TS val 56918984 ecr 4054953916], length 0
03:27:21.905429 IP 192.168.1.14.5353 > 224.0.0.251.5353: 0 PTR (QM)? _spotify-connect._tcp.local. (45)
